{
  "$schema": "https://cyclonedx.org/schema/bom-1.7.schema.json",
  "bomFormat": "CycloneDX",
  "specVersion": "1.7",
  "serialNumber": "urn:uuid:d5a8b698-805c-59d4-ad1d-bf6632119669",
  "version": 1,
  "metadata": {
    "timestamp": "2026-09-13T08:04:22.205Z",
    "tools": {
      "components": [
        {
          "type": "application",
          "bom-ref": "pkg:npm/cydetix@0.6.0-alpha.12",
          "name": "cydetix",
          "version": "0.6.0-alpha.12",
          "purl": "pkg:npm/cydetix@0.6.0-alpha.12"
        }
      ]
    },
    "component": {
      "type": "application",
      "bom-ref": "pkg:npm/cydetix@0.6.0-alpha.12",
      "name": "cydetix",
      "version": "0.6.0-alpha.12",
      "purl": "pkg:npm/cydetix@0.6.0-alpha.12"
    }
  },
  "components": [
    {
      "type": "library",
      "bom-ref": "pkg:npm/%40babel/code-frame@8.0.0",
      "name": "@babel/code-frame",
      "version": "8.0.0",
      "purl": "pkg:npm/%40babel/code-frame@8.0.0",
      "scope": "required",
      "properties": [
        {
          "name": "cydetix:dependency-kind",
          "value": "transitive"
        },
        {
          "name": "cydetix:resolved",
          "value": "true"
        },
        {
          "name": "cydetix:source",
          "value": "registry"
        }
      ]
    },
    {
      "type": "library",
      "bom-ref": "pkg:npm/%40babel/generator@8.0.0",
      "name": "@babel/generator",
      "version": "8.0.0",
      "purl": "pkg:npm/%40babel/generator@8.0.0",
      "scope": "required",
      "properties": [
        {
          "name": "cydetix:dependency-kind",
          "value": "transitive"
        },
        {
          "name": "cydetix:resolved",
          "value": "true"
        },
        {
          "name": "cydetix:source",
          "value": "registry"
        }
      ]
    },
    {
      "type": "library",
      "bom-ref": "pkg:npm/%40babel/helper-globals@8.0.0",
      "name": "@babel/helper-globals",
      "version": "8.0.0",
      "purl": "pkg:npm/%40babel/helper-globals@8.0.0",
      "scope": "required",
      "properties": [
        {
          "name": "cydetix:dependency-kind",
          "value": "transitive"
        },
        {
          "name": "cydetix:resolved",
          "value": "true"
        },
        {
          "name": "cydetix:source",
          "value": "registry"
        }
      ]
    },
    {
      "type": "library",
      "bom-ref": "pkg:npm/%40babel/helper-string-parser@7.29.7",
      "name": "@babel/helper-string-parser",
      "version": "7.29.7",
      "purl": "pkg:npm/%40babel/helper-string-parser@7.29.7",
      "scope": "required",
      "properties": [
        {
          "name": "cydetix:dependency-kind",
          "value": "transitive"
        },
        {
          "name": "cydetix:resolved",
          "value": "true"
        },
        {
          "name": "cydetix:source",
          "value": "registry"
        }
      ]
    },
    {
      "type": "library",
      "bom-ref": "pkg:npm/%40babel/helper-string-parser@8.0.0",
      "name": "@babel/helper-string-parser",
      "version": "8.0.0",
      "purl": "pkg:npm/%40babel/helper-string-parser@8.0.0",
      "scope": "required",
      "properties": [
        {
          "name": "cydetix:dependency-kind",
          "value": "transitive"
        },
        {
          "name": "cydetix:resolved",
          "value": "true"
        },
        {
          "name": "cydetix:source",
          "value": "registry"
        }
      ]
    },
    {
      "type": "library",
      "bom-ref": "pkg:npm/%40babel/helper-validator-identifier@7.29.7",
      "name": "@babel/helper-validator-identifier",
      "version": "7.29.7",
      "purl": "pkg:npm/%40babel/helper-validator-identifier@7.29.7",
      "scope": "required",
      "properties": [
        {
          "name": "cydetix:dependency-kind",
          "value": "transitive"
        },
        {
          "name": "cydetix:resolved",
          "value": "true"
        },
        {
          "name": "cydetix:source",
          "value": "registry"
        }
      ]
    },
    {
      "type": "library",
      "bom-ref": "pkg:npm/%40babel/helper-validator-identifier@8.0.4",
      "name": "@babel/helper-validator-identifier",
      "version": "8.0.4",
      "purl": "pkg:npm/%40babel/helper-validator-identifier@8.0.4",
      "scope": "required",
      "properties": [
        {
          "name": "cydetix:dependency-kind",
          "value": "transitive"
        },
        {
          "name": "cydetix:resolved",
          "value": "true"
        },
        {
          "name": "cydetix:source",
          "value": "registry"
        }
      ]
    },
    {
      "type": "library",
      "bom-ref": "pkg:npm/%40babel/parser@8.0.4",
      "name": "@babel/parser",
      "version": "8.0.4",
      "purl": "pkg:npm/%40babel/parser@8.0.4",
      "scope": "required",
      "properties": [
        {
          "name": "cydetix:dependency-kind",
          "value": "direct"
        },
        {
          "name": "cydetix:resolved",
          "value": "true"
        },
        {
          "name": "cydetix:source",
          "value": "registry"
        }
      ]
    },
    {
      "type": "library",
      "bom-ref": "pkg:npm/%40babel/template@8.0.0",
      "name": "@babel/template",
      "version": "8.0.0",
      "purl": "pkg:npm/%40babel/template@8.0.0",
      "scope": "required",
      "properties": [
        {
          "name": "cydetix:dependency-kind",
          "value": "transitive"
        },
        {
          "name": "cydetix:resolved",
          "value": "true"
        },
        {
          "name": "cydetix:source",
          "value": "registry"
        }
      ]
    },
    {
      "type": "library",
      "bom-ref": "pkg:npm/%40babel/traverse@8.0.4",
      "name": "@babel/traverse",
      "version": "8.0.4",
      "purl": "pkg:npm/%40babel/traverse@8.0.4",
      "scope": "required",
      "properties": [
        {
          "name": "cydetix:dependency-kind",
          "value": "direct"
        },
        {
          "name": "cydetix:resolved",
          "value": "true"
        },
        {
          "name": "cydetix:source",
          "value": "registry"
        }
      ]
    },
    {
      "type": "library",
      "bom-ref": "pkg:npm/%40babel/types@7.29.8",
      "name": "@babel/types",
      "version": "7.29.8",
      "purl": "pkg:npm/%40babel/types@7.29.8",
      "scope": "required",
      "properties": [
        {
          "name": "cydetix:dependency-kind",
          "value": "transitive"
        },
        {
          "name": "cydetix:resolved",
          "value": "true"
        },
        {
          "name": "cydetix:source",
          "value": "registry"
        }
      ]
    },
    {
      "type": "library",
      "bom-ref": "pkg:npm/%40babel/types@8.0.4",
      "name": "@babel/types",
      "version": "8.0.4",
      "purl": "pkg:npm/%40babel/types@8.0.4",
      "scope": "required",
      "properties": [
        {
          "name": "cydetix:dependency-kind",
          "value": "direct"
        },
        {
          "name": "cydetix:resolved",
          "value": "true"
        },
        {
          "name": "cydetix:source",
          "value": "registry"
        }
      ]
    },
    {
      "type": "library",
      "bom-ref": "pkg:npm/%40esbuild/aix-ppc64@0.28.2",
      "name": "@esbuild/aix-ppc64",
      "version": "0.28.2",
      "purl": "pkg:npm/%40esbuild/aix-ppc64@0.28.2",
      "scope": "optional",
      "properties": [
        {
          "name": "cydetix:dependency-kind",
          "value": "transitive"
        },
        {
          "name": "cydetix:resolved",
          "value": "true"
        },
        {
          "name": "cydetix:source",
          "value": "registry"
        }
      ]
    },
    {
      "type": "library",
      "bom-ref": "pkg:npm/%40esbuild/android-arm@0.28.2",
      "name": "@esbuild/android-arm",
      "version": "0.28.2",
      "purl": "pkg:npm/%40esbuild/android-arm@0.28.2",
      "scope": "optional",
      "properties": [
        {
          "name": "cydetix:dependency-kind",
          "value": "transitive"
        },
        {
          "name": "cydetix:resolved",
          "value": "true"
        },
        {
          "name": "cydetix:source",
          "value": "registry"
        }
      ]
    },
    {
      "type": "library",
      "bom-ref": "pkg:npm/%40esbuild/android-arm64@0.28.2",
      "name": "@esbuild/android-arm64",
      "version": "0.28.2",
      "purl": "pkg:npm/%40esbuild/android-arm64@0.28.2",
      "scope": "optional",
      "properties": [
        {
          "name": "cydetix:dependency-kind",
          "value": "transitive"
        },
        {
          "name": "cydetix:resolved",
          "value": "true"
        },
        {
          "name": "cydetix:source",
          "value": "registry"
        }
      ]
    },
    {
      "type": "library",
      "bom-ref": "pkg:npm/%40esbuild/android-x64@0.28.2",
      "name": "@esbuild/android-x64",
      "version": "0.28.2",
      "purl": "pkg:npm/%40esbuild/android-x64@0.28.2",
      "scope": "optional",
      "properties": [
        {
          "name": "cydetix:dependency-kind",
          "value": "transitive"
        },
        {
          "name": "cydetix:resolved",
          "value": "true"
        },
        {
          "name": "cydetix:source",
          "value": "registry"
        }
      ]
    },
    {
      "type": "library",
      "bom-ref": "pkg:npm/%40esbuild/darwin-arm64@0.28.2",
      "name": "@esbuild/darwin-arm64",
      "version": "0.28.2",
      "purl": "pkg:npm/%40esbuild/darwin-arm64@0.28.2",
      "scope": "optional",
      "properties": [
        {
          "name": "cydetix:dependency-kind",
          "value": "transitive"
        },
        {
          "name": "cydetix:resolved",
          "value": "true"
        },
        {
          "name": "cydetix:source",
          "value": "registry"
        }
      ]
    },
    {
      "type": "library",